{
  "schema_version": "1.0.0",
  "assignment_id": "demo-unplayable",
  "content_id": "unplayable_note",
  "timeline": {
    "ticks_per_quarter": 480,
    "total_ticks": 1440,
    "tempo_changes": [
      {
        "schema_version": "1.0.0",
        "tick": 0,
        "microseconds_per_quarter": 600000
      }
    ]
  },
  "events": [
    {
      "event_id": "ev-1",
      "midi_note": 45,
      "velocity": 80,
      "onset_seconds": 0.0,
      "release_seconds": 0.6,
      "cents_offset": null
    },
    {
      "event_id": "ev-2",
      "midi_note": 30,
      "velocity": 80,
      "onset_seconds": 0.6,
      "release_seconds": 1.2,
      "cents_offset": null
    },
    {
      "event_id": "ev-3",
      "midi_note": 47,
      "velocity": 80,
      "onset_seconds": 1.2,
      "release_seconds": 1.7999999999999998,
      "cents_offset": null
    }
  ],
  "total_seconds": 1.7999999999999998,
  "warnings": [],
  "unsupported_features": [],
  "playback_digest": "sha256:e006564b5e8b5c084f37a0415fe9a0d825e1e78187ee59e4cb564f75969e0260",
  "canonical_revision_id": null
}
