{
  "schema_version": "1.0.0",
  "assignment_id": "demo-teacher-override",
  "content_id": "teacher_override",
  "timeline": {
    "ticks_per_quarter": 480,
    "total_ticks": 960,
    "tempo_changes": [
      {
        "schema_version": "1.0.0",
        "tick": 0,
        "microseconds_per_quarter": 600000
      }
    ]
  },
  "events": [
    {
      "event_id": "ev-1",
      "midi_note": 64,
      "velocity": 80,
      "onset_seconds": 0.0,
      "release_seconds": 0.6,
      "cents_offset": null
    },
    {
      "event_id": "ev-2",
      "midi_note": 67,
      "velocity": 80,
      "onset_seconds": 0.6,
      "release_seconds": 1.2,
      "cents_offset": null
    }
  ],
  "total_seconds": 1.2,
  "warnings": [],
  "unsupported_features": [],
  "playback_digest": "sha256:11771e378f97a4a3dc926a88ad02e0a70fc0e4809c334c26ac67af193a2e4c47",
  "canonical_revision_id": null
}
