{
  "schema_version": "1.0.0",
  "assignment_id": "demo-position-shift",
  "content_id": "position_shift",
  "timeline": {
    "ticks_per_quarter": 480,
    "total_ticks": 3840,
    "tempo_changes": [
      {
        "schema_version": "1.0.0",
        "tick": 0,
        "microseconds_per_quarter": 600000
      }
    ]
  },
  "events": [
    {
      "event_id": "ev-1",
      "midi_note": 40,
      "velocity": 80,
      "onset_seconds": 0.0,
      "release_seconds": 0.6,
      "cents_offset": null
    },
    {
      "event_id": "ev-2",
      "midi_note": 42,
      "velocity": 80,
      "onset_seconds": 0.6,
      "release_seconds": 1.2,
      "cents_offset": null
    },
    {
      "event_id": "ev-3",
      "midi_note": 43,
      "velocity": 80,
      "onset_seconds": 1.2,
      "release_seconds": 1.7999999999999998,
      "cents_offset": null
    },
    {
      "event_id": "ev-4",
      "midi_note": 45,
      "velocity": 80,
      "onset_seconds": 1.7999999999999998,
      "release_seconds": 2.4,
      "cents_offset": null
    },
    {
      "event_id": "ev-5",
      "midi_note": 64,
      "velocity": 80,
      "onset_seconds": 2.4,
      "release_seconds": 3.0,
      "cents_offset": null
    },
    {
      "event_id": "ev-6",
      "midi_note": 66,
      "velocity": 80,
      "onset_seconds": 3.0,
      "release_seconds": 3.5999999999999996,
      "cents_offset": null
    },
    {
      "event_id": "ev-7",
      "midi_note": 67,
      "velocity": 80,
      "onset_seconds": 3.5999999999999996,
      "release_seconds": 4.2,
      "cents_offset": null
    },
    {
      "event_id": "ev-8",
      "midi_note": 69,
      "velocity": 80,
      "onset_seconds": 4.2,
      "release_seconds": 4.8,
      "cents_offset": null
    }
  ],
  "total_seconds": 4.8,
  "warnings": [],
  "unsupported_features": [],
  "playback_digest": "sha256:cffe44c749155773c8a90d709cee4cb16dc016f167f4f57fec560af8ca0ebdbe",
  "canonical_revision_id": null
}
